{"contract_version":"corridor-lab.scenario/v1","description":"A deterministic fictional portfolio scenario derived from the built-in demo.","fictional":true,"objective":{"guardrails":{"maximum_tail_hours":"24","minimum_probability_by_deadline":"0.80"},"metric":"maximize_expected_recipient_amount"},"routes":[{"contract_version":"corridor-lab.route/v1","fictional":true,"fixed_fee_send":"3.00","fx_rate":"1.7500","fx_spread_bps":"75","label":"Linked instant-payment demonstration route (fictional)","liquidity":{"annual_cost_of_capital_bps":"650","holding_days":"1.4","prefunding_amount_send":"6500"},"outcomes":[{"completion":"success","delay_hours":"1.5","outcome_id":"on-time","probability":"0.94","recovery_amount_send":"0","recovery_delay_hours":"0"},{"completion":"success","delay_hours":"8","outcome_id":"late-success","probability":"0.04","recovery_amount_send":"0","recovery_delay_hours":"0"},{"completion":"failure","delay_hours":"2","outcome_id":"failed-recovered","probability":"0.02","recovery_amount_send":"980","recovery_delay_hours":"12"}],"percent_fee_bps":"30","route_id":"fictional-gui-linked-instant"},{"contract_version":"corridor-lab.route/v1","fictional":true,"fixed_fee_send":"2.00","fx_rate":"1.7500","fx_spread_bps":"45","label":"Tokenized-deposit demonstration route (fictional)","liquidity":{"annual_cost_of_capital_bps":"600","holding_days":"0.5","prefunding_amount_send":"4000"},"outcomes":[{"completion":"success","delay_hours":"0.5","outcome_id":"on-time","probability":"0.96","recovery_amount_send":"0","recovery_delay_hours":"0"},{"completion":"success","delay_hours":"2","outcome_id":"late-success","probability":"0.025","recovery_amount_send":"0","recovery_delay_hours":"0"},{"completion":"failure","delay_hours":"1","outcome_id":"failed-recovered","probability":"0.015","recovery_amount_send":"975","recovery_delay_hours":"8"}],"percent_fee_bps":"20","route_id":"fictional-gui-tokenized-deposit"}],"scenario_id":"fictional-amber-faster-deadline","transaction":{"deadline_hours":"4","receive_currency":"BRC","receive_precision":2,"rounding":"ROUND_HALF_UP","send_amount":"1000.00","send_currency":"AMR","send_precision":2,"volume_per_period":"100"}}
